{
  "apiVersion": "qos-binding/v1",
  "kind": "Optimization",
  "metadata": {
    "name": "benatallah2002_selfserv_travel_solution_cts_itas_multi_soft_optimization"
  },
  "spec": {
    "penalties": [
      {
        "constraint": {
          "resource": "constraints",
          "id": "gen_c_global_latency_ms_1"
        }
      },
      {
        "constraint": {
          "resource": "constraints",
          "id": "gen_c_local_t_flight_booking_domestic_reliability_1"
        }
      },
      {
        "constraint": {
          "resource": "constraints",
          "id": "gen_c_dep_same_1"
        }
      }
    ],
    "criteria": [
      {
        "id": "availability",
        "feature": {
          "resource": "application",
          "id": "availability"
        },
        "normalize": {
          "min": 0,
          "max": 1
        }
      },
      {
        "id": "cost_usd",
        "feature": {
          "resource": "application",
          "id": "cost_usd"
        },
        "normalize": {
          "min": 0,
          "max": 5000
        }
      },
      {
        "id": "latency_ms",
        "feature": {
          "resource": "application",
          "id": "latency_ms"
        },
        "normalize": {
          "min": 0,
          "max": 10000
        }
      }
    ]
  }
}
