{
  "apiVersion": "qos-binding/v1",
  "kind": "Optimization",
  "metadata": {
    "name": "cremaschi2018_textbook_access_multi_soft_optimization"
  },
  "spec": {
    "penalties": [
      {
        "constraint": {
          "resource": "constraints",
          "id": "gen_c_global_latency_ms_1"
        },
        "weight": 1
      },
      {
        "constraint": {
          "resource": "constraints",
          "id": "gen_c_local_t_books_reliability_1"
        },
        "weight": 1
      },
      {
        "constraint": {
          "resource": "constraints",
          "id": "gen_c_dep_same_1"
        },
        "weight": 1
      }
    ],
    "criteria": [
      {
        "id": "availability",
        "feature": {
          "resource": "application",
          "id": "availability"
        },
        "normalize": {
          "min": 0,
          "max": 1,
          "clamp": true
        }
      },
      {
        "id": "cost_usd",
        "feature": {
          "resource": "application",
          "id": "cost_usd"
        },
        "normalize": {
          "min": 0,
          "max": 10,
          "clamp": true
        }
      },
      {
        "id": "latency_ms",
        "feature": {
          "resource": "application",
          "id": "latency_ms"
        },
        "normalize": {
          "min": 0,
          "max": 10000,
          "clamp": true
        }
      }
    ]
  }
}
