{
  "apiVersion": "qos-binding/v1",
  "kind": "Optimization",
  "metadata": {
    "name": "small_placement_cloud_only_optimization"
  },
  "spec": {
    "criteria": [
      {
        "id": "latency",
        "feature": {
          "resource": "application",
          "id": "latency"
        },
        "normalize": {
          "min": 0,
          "max": 100,
          "clamp": true
        }
      },
      {
        "id": "cost",
        "feature": {
          "resource": "application",
          "id": "cost"
        },
        "normalize": {
          "min": 0,
          "max": 50,
          "clamp": true
        }
      },
      {
        "id": "security",
        "feature": {
          "resource": "application",
          "id": "security"
        },
        "normalize": {
          "min": 0,
          "max": 1,
          "clamp": true
        }
      }
    ]
  }
}
