{
  "apiVersion": "qos-binding/v1",
  "kind": "Optimization",
  "metadata": {
    "name": "zhang2014_entertainment_planner_running_example_mono_one_soft_optimization"
  },
  "spec": {
    "penalties": [
      {
        "constraint": {
          "resource": "constraints",
          "id": "c_within_2km"
        },
        "weight": 1
      },
      {
        "constraint": {
          "resource": "constraints",
          "id": "c_time_budget"
        },
        "weight": 1
      },
      {
        "constraint": {
          "resource": "constraints",
          "id": "c_cost_budget"
        },
        "weight": 1
      },
      {
        "constraint": {
          "resource": "constraints",
          "id": "gen_c_global_cost_1"
        },
        "weight": 1
      },
      {
        "constraint": {
          "resource": "constraints",
          "id": "gen_c_local_t_movie_availability_1"
        },
        "weight": 1
      },
      {
        "constraint": {
          "resource": "constraints",
          "id": "gen_c_dep_same_1"
        },
        "weight": 1
      }
    ],
    "criteria": [
      {
        "id": "availability",
        "feature": {
          "resource": "application",
          "id": "availability"
        },
        "normalize": {
          "min": 0,
          "max": 1,
          "clamp": true
        }
      }
    ]
  }
}
